{
  "schema": "aos-execution-plan.v2",
  "release": "v0.2.0",
  "repository": "MongLong0214/agent-operator-score",
  "epic": 573,
  "milestone": 14,
  "milestone_title": "v0.2.0 — SSOT v3 Execution-Governed Measurement Integrity & Zero-config UX",
  "integration_branch": "dev",
  "body_marker": "FINAL_EXECUTION_CONTRACT_2026-09-01_V3",
  "epic_body_marker": "FINAL_EXECUTION_SSOT_2026-09-01_V3",
  "release_label": "release:v0.2.0",
  "excluded_issues": [
    579,
    580,
    581
  ],
  "phase_output_vocabulary": [
    "safe-evidence-matrix",
    "platform-probe-record",
    "stale-branch-audit-report",
    "branch-deletion-log",
    "implementation",
    "tests",
    "documentation"
  ],
  "gates": {
    "X": [
      588
    ],
    "S": [
      553,
      554,
      555,
      556,
      557
    ],
    "C": [
      582,
      559,
      560,
      558,
      583
    ],
    "G": [
      561,
      564,
      584,
      585,
      568,
      586,
      562,
      563
    ],
    "E": [
      566,
      567
    ],
    "Q": [
      565
    ],
    "U": [
      574,
      575,
      576
    ],
    "R": [
      569,
      570,
      571,
      577
    ],
    "P": [
      578
    ]
  },
  "issues": [
    {
      "issue": 553,
      "kind": "implementation",
      "status": "done",
      "batch": 0,
      "implementation_blocked_by": [],
      "acceptance_blocked_by": [],
      "blocks": [
        557,
        562,
        564,
        569,
        578
      ],
      "priority": "P0",
      "area": "security",
      "release_critical": true,
      "owner_surfaces": [
        "trusted-verifier-boundary"
      ],
      "owned_paths": [
        "lib/verifier-run.mjs",
        "lib/verifiers/"
      ],
      "evidence_bindings": {},
      "allowed_parallel_with": [
        554,
        555,
        565,
        567,
        570,
        572,
        582,
        588
      ],
      "phases": [],
      "close_evidence_required": true,
      "required_evidence_fields": [
        "controller_subject_probe_digests",
        "attack_matrix",
        "process_cleanup_matrix",
        "mutation"
      ]
    },
    {
      "issue": 554,
      "kind": "implementation",
      "status": "done",
      "batch": 0,
      "implementation_blocked_by": [],
      "acceptance_blocked_by": [],
      "blocks": [
        556,
        561,
        562,
        569,
        574,
        578
      ],
      "priority": "P0",
      "area": "security",
      "release_critical": true,
      "owner_surfaces": [
        "executable-bound-credential"
      ],
      "owned_paths": [
        "lib/runtime-auth.mjs"
      ],
      "evidence_bindings": {},
      "allowed_parallel_with": [
        553,
        555,
        565,
        567,
        570,
        572,
        582,
        588
      ],
      "phases": [],
      "close_evidence_required": true,
      "required_evidence_fields": [
        "executable_identity_binding",
        "credential_canary",
        "mutation"
      ]
    },
    {
      "issue": 555,
      "kind": "implementation",
      "status": "done",
      "batch": 0,
      "implementation_blocked_by": [],
      "acceptance_blocked_by": [],
      "blocks": [
        556,
        562,
        569,
        574,
        578
      ],
      "priority": "P0",
      "area": "security",
      "release_critical": true,
      "owner_surfaces": [
        "adapter-env-allowlist"
      ],
      "owned_paths": [
        "lib/env-policy.mjs",
        "lib/isolation.mjs"
      ],
      "evidence_bindings": {},
      "allowed_parallel_with": [
        553,
        554,
        565,
        567,
        570,
        572,
        582,
        588
      ],
      "phases": [],
      "close_evidence_required": true,
      "required_evidence_fields": [
        "env_allowlist_digest",
        "leak_canary",
        "mutation"
      ]
    },
    {
      "issue": 556,
      "kind": "implementation",
      "status": "done",
      "batch": 1,
      "implementation_blocked_by": [
        554,
        555
      ],
      "acceptance_blocked_by": [
        588
      ],
      "blocks": [
        557,
        562,
        569,
        574,
        578
      ],
      "priority": "P0",
      "area": "security",
      "release_critical": true,
      "owner_surfaces": [
        "strict-workspace-confinement"
      ],
      "owned_paths": [
        "docs/STRICT_CONFINEMENT_FEASIBILITY.md",
        "fixtures/confinement/",
        "lib/confinement.mjs"
      ],
      "evidence_bindings": {},
      "allowed_parallel_with": [
        559,
        561
      ],
      "phases": [
        {
          "id": "feasibility-proof",
          "status": "done",
          "blocked_by": [],
          "allowed_outputs": [
            "safe-evidence-matrix",
            "platform-probe-record"
          ],
          "code_integration_allowed": false
        },
        {
          "id": "final-integration",
          "status": "done",
          "blocked_by": [
            554,
            555,
            588
          ],
          "allowed_outputs": [
            "implementation",
            "tests",
            "documentation"
          ],
          "code_integration_allowed": true
        }
      ],
      "close_evidence_required": true,
      "required_evidence_fields": [
        "isolation_backend",
        "boundary_canary",
        "platform_lane",
        "mutation"
      ]
    },
    {
      "issue": 557,
      "kind": "implementation",
      "status": "done",
      "batch": 2,
      "implementation_blocked_by": [
        553,
        556,
        559
      ],
      "acceptance_blocked_by": [
        588
      ],
      "blocks": [
        562,
        566,
        569,
        578
      ],
      "priority": "P0",
      "area": "security",
      "release_critical": true,
      "owner_surfaces": [
        "actual-effect-safety"
      ],
      "owned_paths": [
        "lib/observe.mjs",
        "lib/file-effects.mjs"
      ],
      "evidence_bindings": {},
      "allowed_parallel_with": [
        560,
        574
      ],
      "phases": [],
      "close_evidence_required": true,
      "required_evidence_fields": [
        "actual_effect_observation",
        "safety_canary",
        "mutation"
      ]
    },
    {
      "issue": 558,
      "kind": "implementation",
      "status": "done",
      "batch": 3,
      "implementation_blocked_by": [
        559,
        560,
        582
      ],
      "acceptance_blocked_by": [
        588
      ],
      "blocks": [
        562,
        564,
        569,
        578,
        583
      ],
      "priority": "P0",
      "area": "measurement",
      "release_critical": true,
      "owner_surfaces": [
        "routing-oracle"
      ],
      "owned_paths": [
        "lib/routing-oracle.mjs",
        "lib/metrics.mjs"
      ],
      "evidence_bindings": {},
      "allowed_parallel_with": [
        566
      ],
      "phases": [],
      "close_evidence_required": true,
      "required_evidence_fields": [
        "route_oracle_digest",
        "counterfactual",
        "mutation"
      ]
    },
    {
      "issue": 559,
      "kind": "implementation",
      "status": "done",
      "batch": 1,
      "implementation_blocked_by": [
        582
      ],
      "acceptance_blocked_by": [
        588
      ],
      "blocks": [
        557,
        558,
        560,
        562,
        566,
        568,
        569,
        576,
        578,
        583,
        584
      ],
      "priority": "P0",
      "area": "measurement",
      "release_critical": true,
      "owner_surfaces": [
        "result-schema",
        "profile-aggregation"
      ],
      "owned_paths": [
        "lib/result-schema.mjs",
        "lib/report-card.mjs",
        "schemas/aos-result"
      ],
      "evidence_bindings": {},
      "allowed_parallel_with": [
        556,
        561
      ],
      "phases": [],
      "close_evidence_required": true,
      "required_evidence_fields": [
        "result_schema_digest",
        "aggregation_vectors",
        "mutation"
      ]
    },
    {
      "issue": 560,
      "kind": "implementation",
      "status": "done",
      "batch": 2,
      "implementation_blocked_by": [
        559,
        582
      ],
      "acceptance_blocked_by": [
        588
      ],
      "blocks": [
        558,
        562,
        564,
        569,
        576,
        578,
        583
      ],
      "priority": "P0",
      "area": "measurement",
      "release_critical": true,
      "owner_surfaces": [
        "operator-events"
      ],
      "owned_paths": [
        "lib/operator-events.mjs",
        "lib/operator-plan.mjs"
      ],
      "evidence_bindings": {},
      "allowed_parallel_with": [
        557,
        574
      ],
      "phases": [],
      "close_evidence_required": true,
      "required_evidence_fields": [
        "operator_event_schema_digest",
        "opportunity_binding",
        "mutation"
      ]
    },
    {
      "issue": 561,
      "kind": "implementation",
      "status": "done",
      "batch": 1,
      "implementation_blocked_by": [
        554
      ],
      "acceptance_blocked_by": [
        588
      ],
      "blocks": [
        562,
        569,
        574,
        578,
        584
      ],
      "priority": "P0",
      "area": "measurement",
      "release_critical": true,
      "owner_surfaces": [
        "runtime-model-identity"
      ],
      "owned_paths": [
        "lib/runtime-identity.mjs",
        "lib/profile.mjs"
      ],
      "evidence_bindings": {},
      "allowed_parallel_with": [
        556,
        559
      ],
      "phases": [],
      "close_evidence_required": true,
      "required_evidence_fields": [
        "model_identity_digest",
        "comparability_rule",
        "mutation"
      ]
    },
    {
      "issue": 562,
      "kind": "implementation",
      "status": "done",
      "batch": 7,
      "implementation_blocked_by": [
        553,
        554,
        555,
        556,
        557,
        558,